{
  "schema_version": 1,
  "contract_version": 6,
  "mechanic_id": "cr-508-declare-attackers-step",
  "official_name": "Declare Attackers Step",
  "effective_date": "2026-06-19",
  "source_sha256": "e99cd70eb64ca854acb6420ebbf06e369e3f258e0cfba4f03f70bd881386f79b",
  "rule_references": [
    "508",
    "508.1",
    "508.1a",
    "508.1b",
    "508.1c",
    "508.1d",
    "508.1e",
    "508.1f",
    "508.1g",
    "508.1h",
    "508.1i",
    "508.1j",
    "508.1k",
    "508.1m",
    "508.2",
    "508.2a",
    "508.2b",
    "508.3",
    "508.3a",
    "508.3b",
    "508.3c",
    "508.3d",
    "508.3e",
    "508.3f",
    "508.4",
    "508.4a",
    "508.4b",
    "508.4c",
    "508.4d",
    "508.5",
    "508.5a",
    "508.6",
    "508.7",
    "508.7a",
    "508.7b",
    "508.7c",
    "508.7d",
    "508.7e",
    "508.8"
  ],
  "glossary_references": ["Requirement", "Restriction"],
  "dependencies": [
    "combat",
    "illegal-actions",
    "priority",
    "triggers",
    "mana-abilities",
    "cost-payment",
    "continuous-effects",
    "phasing"
  ],
  "coverage_status": "partial",
  "trust_level": "untrusted",
  "behavior": {
    "zones": ["battlefield"],
    "objects": [
      "attacking creature",
      "defending player",
      "attacked planeswalker",
      "attacked battle"
    ],
    "events": [
      "attackers are declared",
      "attacking relationships become fixed",
      "declare-attackers triggers are created",
      "active player receives priority"
    ],
    "state_reads": [
      "controller",
      "tapped and phased-out state",
      "creature and battle types",
      "summoning sickness, haste, and defender",
      "vigilance",
      "attack target and Battle protector",
      "active typed goad designations and their originating players",
      "whole-line static declaration restrictions and their relevant effective keyword, attachment, and controller predicates"
    ],
    "state_writes": [
      "tapped state",
      "attacking relationship",
      "defending players",
      "attackers-declared marker",
      "priority player"
    ],
    "costs": [
      "whole-line fixed ordinary-mana intrinsic, attached, and defending-player attack taxes are locked and paid atomically",
      "multiple represented costs aggregate, and manual or automatic mana plans use the ordinary mana-ability payment path",
      "optional, nonmana, variable, alternative, modified, and broader conditional attack costs remain blocked"
    ],
    "timing": [
      "ordinary declaration is a turn-based action",
      "active player receives priority after declaration",
      "empty combat skips declare blockers and combat damage"
    ],
    "targets": [
      "represented attackers may attack an opponent or an opponent-protected Battle"
    ],
    "choices": [
      "the active player chooses zero or more eligible attackers and one represented defender for each",
      "the declaration must obey every represented absolute, not-alone, and table-wide count restriction",
      "the declaration must maximize represented attack requirements only within the restriction-obeying declaration space"
    ],
    "hidden_information": [
      "attacker declarations use public combat and battlefield information"
    ],
    "apnap": [
      "one active player declares all attackers; multiplayer defenders are derived per attack target"
    ],
    "layers": [
      "effective types and keywords are read through derived characteristics"
    ],
    "replacement_effects": [],
    "copy": [
      "copies use their effective attack characteristics"
    ],
    "control_change": [
      "a submitted attacker must still be controlled by the active player and not summoning sick"
    ],
    "zone_change": [
      "an attacker and attacked permanent must still be present when the declaration is validated"
    ],
    "source_leaves": [
      "attacking state is cleared when an object leaves combat or combat ends"
    ]
  },
  "variants": [
    "no attackers",
    "ordinary legal attacker",
    "vigilance attacker",
    "tapped, phased-out, Battle, defender, and summoning-sick nonattackers",
    "multiplayer split attacks",
    "opponent-protected Battle",
    "illegal declaration rollback",
    "empty-combat step skipping",
    "single and multiple goaders in duel and multiplayer",
    "fixed-mana intrinsic and defending-player attack taxes",
    "stacked attack taxes and manual mana-source selection",
    "costed attack requirements that do not compel payment",
    "conditional untapped-source attack taxes",
    "player taxes that do not apply to Battles or unsupported planeswalker-only destinations",
    "fixed-mana costs from attached Auras",
    "a chosen attacker sacrificed for mana before CR 508.1k",
    "broader recognized attack-cost grammar stopping fail closed",
    "absolute self, attached, and global attack prohibitions",
    "attack-alone and attack-or-block-alone restrictions across different multiplayer defenders",
    "one- and two-attacker table-wide maxima interacting with attack requirements",
    "keyword-filtered global attack restrictions",
    "recognized unsupported conditional attack restrictions stopping fail closed"
  ],
  "witness_cards": [
    {"name": "Mogg Flunkies", "oracle_id": "b92fc9c1-7264-4894-90b8-a193039489c5"},
    {"name": "Luminous Bonds", "oracle_id": "2c006a63-0550-4a87-a5fe-f4247857271c"},
    {"name": "Silent Arbiter", "oracle_id": "1cdf30de-d88c-421a-80df-4917bbd2f09e"},
    {"name": "Stormtide Leviathan", "oracle_id": "131a7475-0b9e-46eb-9ade-fef1b9820184"},
    {"name": "Peacekeeper", "oracle_id": "e82ce5c6-1e42-4e87-b696-67aa3822ec9c"}
  ],
  "rulings": [
    "Mogg Flunkies — 2018-03-16 — The other attacker may attack a different player, planeswalker, or battle.",
    "Mogg Flunkies — 2018-03-16 — If required to attack and another creature can attack, both must be declared."
  ],
  "test_ids": [
    "test_contract_traces_every_cr_508_rule",
    "test_only_currently_eligible_creatures_are_offered",
    "test_attackers_tap_except_vigilance_then_active_player_gets_priority",
    "test_malicious_phased_attacker_rolls_back_valid_partial_attack",
    "test_phased_out_battle_is_not_an_attack_target",
    "test_duplicate_structured_attacker_is_rejected",
    "test_no_attackers_skips_blockers_and_combat_damage_steps",
    "test_attacking_marker_clears_when_combat_phase_ends",
    "test_multiple_defenders_block_sequentially",
    "test_structured_attack_list_reaches_authoritative_combat_state",
    "test_siege_is_attackable_and_its_protector_blocks",
    "test_battle_creature_cannot_attack_or_block",
    "test_defender_is_not_offered_and_cannot_be_injected_as_an_attacker",
    "test_attack_requirement_is_projected_maximized_and_replayed",
    "test_conflicting_requirements_accept_any_maximal_declaration",
    "test_impossible_requirement_has_zero_maximum",
    "test_search_limit_fails_closed",
    "test_single_goad_requires_another_player_when_available_and_replays",
    "test_goad_in_duel_still_requires_attacking_the_goader",
    "test_multiple_goaders_create_independent_maximized_requirements",
    "test_goaded_by_every_opponent_accepts_any_maximal_attack",
    "test_costed_option_is_optional_for_requirement_maximization",
    "test_elected_cost_does_not_hide_free_requirements",
    "test_prison_tax_is_projected_paid_atomically_and_replays",
    "test_goad_does_not_force_payment_in_duel",
    "test_goad_still_requires_a_free_other_player",
    "test_stacked_prisons_lock_one_aggregate_cost",
    "test_manual_attack_payment_uses_only_the_selected_mana_source",
    "test_attack_player_tax_does_not_apply_to_a_battle",
    "test_untapped_source_condition_controls_attack_tax",
    "test_nonvigilant_attacker_cannot_fund_its_own_attack_cost",
    "test_vigilant_attacker_may_activate_mana_while_cost_is_paid",
    "test_sacrificed_mana_source_does_not_become_an_attacker",
    "test_complex_attack_tax_pauses_fail_closed",
    "test_fixed_attached_attack_cost_uses_existing_attachment_identity",
    "test_broader_conditional_attack_tax_stops_fail_closed",
    "test_planeswalker_only_tax_does_not_tax_a_player_attack",
    "test_oracle_ir_uses_the_runtime_declaration_cost_grammar",
    "test_selected_creature_can_require_another_declaration",
    "test_global_maximum_applies_before_requirement_maximization",
    "test_absolute_self_and_attached_restrictions_remove_domains",
    "test_attack_or_block_alone_allows_different_defenders_and_replays",
    "test_global_maximum_constrains_requirement_solver",
    "test_keyword_filtered_global_attack_restriction",
    "test_relevant_unsupported_condition_pauses_fail_closed",
    "test_triggered_text_is_not_misread_as_a_static_restriction",
    "test_oracle_ir_uses_runtime_restriction_grammar"
  ],
  "implementation": {
    "component": "DeclarationProblem, shared declaration-cost and declaration-restriction Oracle grammars, and the CommanderEngine attacker declaration/payment transition",
    "version": "declare-attackers-step-v6"
  },
  "known_blockers": [
    "planeswalker attack targets are not implemented",
    "exact attacks-each-combat and typed goad requirements are represented; conditional, non-goad defender-specific, and other effect-granted requirement grammar remains incomplete",
    "conditional, compound, target-specific, temporary, and broader attack-restriction grammar remains incomplete and recognized static families fail closed",
    "banding declarations are not implemented",
    "optional, nonmana, variable, alternative, modified, and broader conditional attack costs are not implemented",
    "declare-attackers trigger generation and APNAP placement are incomplete",
    "effects that put creatures onto the battlefield attacking are not implemented",
    "defending-player last-known information and attack-target reselection are not implemented"
  ],
  "review_status": "draft"
}
