{
  "schema_version": 1,
  "contract_version": 1,
  "mechanic_id": "cr-613-interaction-of-continuous-effects",
  "official_name": "Interaction of Continuous Effects",
  "effective_date": "2026-06-19",
  "source_sha256": "e99cd70eb64ca854acb6420ebbf06e369e3f258e0cfba4f03f70bd881386f79b",
  "rule_references": ["613", "613.1", "613.2", "613.3", "613.4", "613.7", "613.8"],
  "glossary_references": [],
  "dependencies": ["continuous-effects", "copying-objects", "characteristic-defining-ability"],
  "coverage_status": "partial",
  "trust_level": "untrusted",
  "behavior": {
    "zones": ["all zones in which a continuous effect applies"],
    "objects": ["objects, players, and game rules affected by continuous effects"],
    "events": ["continuous reevaluation after every relevant state change"],
    "state_reads": ["printed or copiable characteristics", "timestamps", "dependency graph", "effect applicability"],
    "state_writes": ["derived characteristics only; no authoritative zone mutation"],
    "costs": ["cost-changing effects are delegated to the casting and activation cost pipeline"],
    "timing": ["layers 1 through 7", "sublayers 1a/1b and 7a/7b/7c/7d", "timestamp order"],
    "targets": [],
    "choices": ["simultaneous timestamp choices require APNAP collection"],
    "hidden_information": ["derived public characteristics must not reveal hidden copiable values"],
    "apnap": ["simultaneous relative timestamps"],
    "layers": ["copy", "control", "text", "type", "color", "ability", "power/toughness"],
    "replacement_effects": ["as-enters copy and face-up/down choices may feed copiable values"],
    "copy": ["copy effects apply in layer 1a before later characteristic changes"],
    "control_change": ["control-changing effects apply in layer 2"],
    "zone_change": ["new objects and zone changes create or reset timestamps"],
    "source_leaves": ["duration and locked-in affected-object sets determine continued application"]
  },
  "variants": ["characteristic-defining abilities", "dependency cycles", "effects spanning multiple layers"],
  "witness_cards": [],
  "rulings": [],
  "test_ids": [
    "test_layer_order_dominates_timestamp",
    "test_power_toughness_sublayers_set_modify_then_switch",
    "test_dependency_overrides_timestamp_and_cycles_are_audited",
    "test_effect_order_is_stable_under_input_mutation"
  ],
  "implementation": {
    "component": "continuous_effects.evaluate_continuous_effects and CommanderEngine._apply_layered_characteristic_annotations",
    "version": "continuous-layers-v1"
  },
  "known_blockers": [
    "not every existing ad hoc static ability has been converted to a declarative effect",
    "dependency discovery is supplied by the compiler rather than inferred from arbitrary effect programs",
    "player/game-rule effects and APNAP timestamp decisions are not integrated",
    "full face-down, merged permanent, and sticker copiable values are not integrated"
  ],
  "review_status": "draft"
}
