{
  "schema_version": 1,
  "contract_version": 1,
  "mechanic_id": "intimidate",
  "official_name": "Intimidate",
  "effective_date": "2026-06-19",
  "source_sha256": "e99cd70eb64ca854acb6420ebbf06e369e3f258e0cfba4f03f70bd881386f79b",
  "rule_references": [
    "509.1b",
    "702.13",
    "702.13a",
    "702.13b",
    "702.13c"
  ],
  "glossary_references": [
    "intimidate"
  ],
  "dependencies": [
    "declare-blockers",
    "continuous-effects"
  ],
  "coverage_status": "tested",
  "trust_level": "untrusted",
  "behavior": {
    "zones": [
      "battlefield"
    ],
    "objects": [
      "attacking creature",
      "proposed blocker"
    ],
    "events": [
      "declare blockers legality check"
    ],
    "state_reads": [
      "attacker and blocker current represented effective keywords and colors",
      "blocker current represented effective card types"
    ],
    "state_writes": [],
    "costs": [],
    "timing": [
      "current characteristics are evaluated during blocker declaration"
    ],
    "targets": [],
    "choices": [
      "the defending player chooses among block pairs legal after every represented evasion restriction"
    ],
    "hidden_information": [],
    "apnap": [],
    "layers": [
      "current layer-4 types, layer-5 colors, layer-6 abilities, and layer-7 power are consumed when applicable"
    ],
    "replacement_effects": [],
    "copy": [
      "represented copied current characteristics participate"
    ],
    "control_change": [
      "the current defending player declares blockers"
    ],
    "zone_change": [
      "only current phased-in battlefield creatures participate"
    ],
    "source_leaves": [
      "the restriction ceases when the attacking creature leaves combat or loses the keyword"
    ]
  },
  "variants": [
    "shared-color creature exception",
    "artifact creature exception",
    "colorless attacker has no shared-color exception",
    "multiple instances are redundant"
  ],
  "witness_cards": [
    {
      "name": "Krenko's Enforcer",
      "oracle_id": "0d9787e3-f482-4a98-95af-0438ed09c96c"
    }
  ],
  "rulings": [],
  "test_ids": [
    "test_all_represented_restrictions_are_cumulative",
    "test_keyword_bundle_holds_across_bounded_blocker_grid",
    "test_malformed_and_unresolved_inputs_fail_closed",
    "test_offer_and_command_share_cumulative_legality_and_rollback",
    "test_legal_block_replays_exactly_in_four_player_combat",
    "test_ordinary_evasion_keywords_lower_with_precise_closed_spans"
  ],
  "implementation": {
    "component": "mtg_commander_sim.combat_evasion.combat_evasion_verdict, mtg_commander_sim.combat_evasion_engine_adapter.combatant_evasion_characteristics, and CommanderEngine._can_block",
    "version": "ordinary-combat-evasion-restrictions-v1"
  },
  "known_blockers": [
    "conditional and rules-text-equivalent variants remain unsupported",
    "full continuous-effect, copy, face-down, color, type, and ability-changing coverage remains incomplete"
  ],
  "review_status": "reviewed"
}
