{
  "schema_version": 1,
  "contract_version": 1,
  "mechanic_id": "flanking",
  "official_name": "Flanking",
  "effective_date": "2026-06-19",
  "source_sha256": "e99cd70eb64ca854acb6420ebbf06e369e3f258e0cfba4f03f70bd881386f79b",
  "rule_references": ["509", "603.2c", "603.3", "702.25", "702.25a", "702.25b"],
  "glossary_references": ["flanking"],
  "dependencies": ["declare-blockers", "handling-triggered-abilities", "continuous-effects"],
  "coverage_status": "tested",
  "trust_level": "untrusted",
  "behavior": {
    "zones": ["battlefield", "stack"],
    "objects": ["attacking creature with printed Flanking", "blocking creature"],
    "events": ["immutable complete block transition", "ordinary triggered ability", "identity-pinned until-end-of-turn modifier"],
    "state_reads": ["complete block relationships", "current typed Flanking instances on attacker and blocker", "source and affected logical identities"],
    "state_writes": ["ordinary APNAP trigger batch", "layer 7c -1/-1 continuous effect"],
    "costs": [],
    "timing": ["all multiplayer block declarations finish before triggers are placed"],
    "targets": [],
    "choices": ["each controller orders simultaneous triggers through the ordinary APNAP trigger subsystem"],
    "hidden_information": [],
    "apnap": ["all occurrences from one sealed transition are grouped once in APNAP order"],
    "layers": ["the resolving -1/-1 modifier is an identity-locked layer 7c effect until end of turn"],
    "replacement_effects": [],
    "copy": ["only trusted typed current ability fragments participate"],
    "control_change": ["the source controller at trigger creation controls the triggered ability"],
    "zone_change": ["a changed affected-object logical identity receives no modifier"],
    "source_leaves": ["the trigger uses its source snapshot and may still modify a qualifying blocker after the attacker leaves"]
  },
  "variants": ["one blocker without Flanking", "blocker with Flanking excluded", "one occurrence per attacker instance and qualifying blocker", "multiple simultaneous defenders"],
  "witness_cards": [{"name": "Benalish Cavalry", "oracle_id": "0bf619f9-4b19-404c-995f-f23a4b859dd4"}],
  "rulings": [],
  "test_ids": ["test_flanking_triggers_once_per_instance_and_nonflanking_blocker", "test_flanking_does_not_trigger_for_a_blocker_with_flanking", "test_keyword_occurrence_counts_hold_across_bounded_grid", "test_flanking_and_bushido_share_one_sealed_apnap_batch", "test_four_player_block_declarations_finish_before_apnap_trigger_placement", "test_four_player_block_transition_is_public_without_hidden_cards", "test_four_player_block_transition_replays_exactly", "test_flanking_uses_source_snapshot_after_source_leaves", "test_malformed_transition_rolls_back_final_block_declaration", "test_flanking_qualifying_blocker_mutant_is_killed", "test_flanking_and_bushido_lower_with_precise_closed_spans"],
  "implementation": {"component": "quorune.block_transitions and quorune.block_transition_engine_adapter", "version": "typed-block-transition-keyword-triggers-v1"},
  "known_blockers": ["conditional and rules-text-equivalent Flanking wording remains unsupported", "granted, copied, and face-down Flanking requires trusted typed ability fragments", "multi-attacker blocking and trigger-doubling policies remain outside this bounded capability"],
  "review_status": "reviewed"
}
