{
  "schema_version": 1,
  "contract_version": 1,
  "mechanic_id": "double-strike",
  "official_name": "Double Strike",
  "effective_date": "2026-06-19",
  "source_sha256": "e99cd70eb64ca854acb6420ebbf06e369e3f258e0cfba4f03f70bd881386f79b",
  "rule_references": ["702.4", "702.4a", "702.4b", "702.4c", "702.4d", "702.4e"],
  "glossary_references": ["double strike"],
  "dependencies": ["combat-damage-step", "continuous-effects", "copying-objects", "priority"],
  "coverage_status": "partial",
  "trust_level": "untrusted",
  "behavior": {
    "zones": ["battlefield"],
    "objects": ["attacking creature", "blocking creature"],
    "events": ["first combat damage step", "second combat damage step"],
    "state_reads": ["keyword abilities as each damage step begins", "first-step ordinary-combatant snapshot"],
    "state_writes": ["combat damage step index", "first-step participant snapshot"],
    "costs": [],
    "timing": ["a second real combat damage step follows the first", "priority occurs after each damage step"],
    "targets": [],
    "choices": ["combat damage is assigned independently in each applicable step"],
    "hidden_information": [],
    "apnap": [],
    "layers": ["current ability-adding and ability-removing effects are evaluated at each step"],
    "replacement_effects": ["damage replacement and prevention remain delegated to the damage pipeline"],
    "copy": ["copiable characteristics may supply double strike"],
    "control_change": ["a creature removed from combat no longer participates"],
    "zone_change": ["only remaining attackers and blockers participate"],
    "source_leaves": ["a departed combatant does not assign later damage"]
  },
  "variants": ["unblocked damage in both steps", "blocked creature remains blocked after its blocker dies", "lose double strike after step one", "gain double strike after first-strike damage", "multiple instances are redundant"],
  "witness_cards": [{"name": "Adorned Pouncer", "oracle_id": "28f3c157-e004-4fd3-9302-f18ab0bf18ed"}],
  "rulings": [],
  "test_ids": ["test_second_step_uses_the_first_step_snapshot_and_current_double_strike", "test_double_strike_creates_two_real_damage_steps_and_replays", "test_double_strike_does_not_hit_player_after_its_blocker_dies", "test_keyword_contracts_trace_the_pinned_rules"],
  "implementation": {"component": "mtg_commander_sim.combat and CommanderEngine combat-damage step state machine", "version": "combat-keywords-v2"},
  "known_blockers": ["full continuous-effect dependencies, copy, and face-down characteristic evaluation remain incomplete", "the universal simultaneous damage replacement/prevention pipeline remains incomplete", "combat-damage trigger batching before priority remains incomplete"],
  "review_status": "draft"
}
