{
  "schema_version": 1,
  "contract_version": 1,
  "mechanic_id": "reach",
  "official_name": "Reach",
  "effective_date": "2026-06-19",
  "source_sha256": "e99cd70eb64ca854acb6420ebbf06e369e3f258e0cfba4f03f70bd881386f79b",
  "rule_references": ["509.1b", "702.17", "702.17a", "702.17b", "702.17c"],
  "glossary_references": ["reach"],
  "dependencies": [],
  "coverage_status": "trusted",
  "trust_level": "trusted",
  "behavior": {
    "zones": ["battlefield"],
    "objects": ["creature considered as a blocker"],
    "events": ["declare blockers legality check"],
    "state_reads": ["attacker current represented effective keywords", "blocker current represented effective keywords"],
    "state_writes": [],
    "costs": [],
    "timing": ["the Flying restriction is checked for every proposed blocker-attacker pair"],
    "targets": [],
    "choices": ["the defending player chooses among block pairs remaining legal after all represented restrictions"],
    "hidden_information": [],
    "apnap": [],
    "layers": ["the canonical represented layer-6 result is consumed; unsupported ability-changing producers fail trusted preflight"],
    "replacement_effects": [],
    "copy": ["the current represented copied keyword state is consumed; unsupported copy producers fail trusted preflight"],
    "control_change": ["current controller declares the blocker"],
    "zone_change": ["reach is relevant only for a current battlefield creature proposed as a blocker"],
    "source_leaves": ["the exception ceases when reach is absent from the current effective keyword state"]
  },
  "variants": ["reach affects only the Flying restriction", "multiple instances are redundant"],
  "witness_cards": [
    {
      "name": "Giant Spider",
      "oracle_id": "e740ce2f-2134-473c-afa1-1b6d2d1e38ef"
    }
  ],
  "rulings": [],
  "test_ids": [
    "test_flying_attacker_requires_flying_or_reach_blocker",
    "test_current_flying_and_reach_share_offer_and_command_legality",
    "test_current_keywords_are_case_insensitive_and_redundant"
  ],
  "implementation": {
    "component": "mtg_commander_sim.aerial_blocking.aerial_block_verdict",
    "version": "aerial-blocking-v1"
  },
  "known_blockers": [],
  "review_status": "reviewed"
}
